{
  "$schema": "https://json-schema.org/draft/2020-12/schema",
  "$id": "https://github.com/dreamabout/kaikei-envelope/schemas/v1/order_shipped.payload.schema.json",
  "title": "order.shipped payload (v1 mirror)",
  "description": "Mirrors validateShippedData() in Kaikei's PayloadValidator. Data objects are intentionally NOT additionalProperties:false (Kaikei is lenient on unknown data keys). B2B-conditional required fields (customer_id, vat_number, address, email-unless-EAN) are enforced PHP-side, not by this schema.",
  "type": "object",
  "required": [
    "order_id",
    "customer",
    "items"
  ],
  "properties": {
    "order_id": {
      "type": "string",
      "minLength": 1
    },
    "customer": {
      "$ref": "#/$defs/customer"
    },
    "items": {
      "type": "array",
      "minItems": 1,
      "items": {
        "$ref": "#/$defs/item"
      }
    },
    "currency": {
      "$ref": "#/$defs/currency"
    },
    "fx_rate_to_dkk": {
      "$ref": "#/$defs/positive_decimal"
    },
    "prepayment_event_id": {
      "$ref": "#/$defs/ulid_or_uuid"
    },
    "invoice_number": {
      "type": "string",
      "minLength": 1
    }
  },
  "$defs": {
    "decimal": {
      "type": "string",
      "pattern": "^-?\\d+(\\.\\d+)?$"
    },
    "positive_decimal": {
      "type": "string",
      "pattern": "^\\d+(\\.\\d+)?$"
    },
    "currency": {
      "type": "string",
      "pattern": "^[A-Z]{3}$"
    },
    "ulid_or_uuid": {
      "type": "string",
      "pattern": "^([0-9A-HJKMNP-TV-Z]{26}|[0-9a-fA-F]{8}-[0-9a-fA-F]{4}-[0-9a-fA-F]{4}-[0-9a-fA-F]{4}-[0-9a-fA-F]{12})$"
    },
    "customer": {
      "type": "object",
      "required": [
        "country_code",
        "is_b2b"
      ],
      "properties": {
        "country_code": {
          "type": "string"
        },
        "postal_code": {
          "type": "string",
          "pattern": "^[A-Za-z0-9][A-Za-z0-9 -]{0,11}$",
          "description": "DELIVERY postal code, from the same address as country_code. Determines the VAT territory: 78266 is Buesingen (outside the EU VAT area entirely), 6691 is Jungholz (19%, not Austria's 20%). A billing postal code paired with a delivery country is wrong in exactly the cases this exists to catch."
        },
        "is_b2b": {
          "type": "boolean"
        },
        "customer_id": {
          "type": "string"
        },
        "name": {
          "type": "string"
        },
        "email": {
          "type": "string"
        },
        "vat_number": {
          "type": "string"
        },
        "ean_number": {
          "type": "string",
          "pattern": "^\\d{13}$"
        },
        "address": {
          "type": "object",
          "properties": {
            "street": {
              "type": "string"
            },
            "city": {
              "type": "string"
            },
            "postal_code": {
              "type": "string"
            },
            "country": {
              "type": "string"
            }
          }
        }
      }
    },
    "item": {
      "type": "object",
      "required": [
        "type",
        "gross_amount",
        "vat_amount",
        "vat_rate"
      ],
      "properties": {
        "type": {
          "type": "string",
          "enum": [
            "physical",
            "gift_card",
            "digital"
          ]
        },
        "gross_amount": {
          "$ref": "#/$defs/decimal"
        },
        "vat_amount": {
          "$ref": "#/$defs/decimal"
        },
        "vat_rate": {
          "$ref": "#/$defs/decimal"
        }
      }
    }
  }
}
